{
  "$schema": "https://json-schema.org/draft/2020-12/schema",
  "$id": "https://life-fi.local/contracts/results.schema.json",
  "title": "Result",
  "description": "One result from the engine to the server, every 0.5 s (plan-v2 §4.5, version 2). Also the payload of the `result` WebSocket message.",
  "type": "object",
  "additionalProperties": false,
  "required": [
    "type",
    "v",
    "ts",
    "t_rx_last_us",
    "node",
    "boot_id",
    "source",
    "config_hash",
    "pipeline_version",
    "health",
    "calibration",
    "presence",
    "motion",
    "posture",
    "count",
    "activity",
    "breathing",
    "csi",
    "events",
    "active"
  ],
  "properties": {
    "type": {
      "const": "result"
    },
    "v": {
      "const": 2
    },
    "ts": {
      "type": "integer",
      "description": "Host wall-clock, ms since epoch, when the result was produced"
    },
    "t_rx_last_us": {
      "type": "integer",
      "description": "Host wall-clock, µs since epoch, of the last CSI frame used"
    },
    "node": {
      "type": "integer",
      "minimum": 0,
      "maximum": 255
    },
    "boot_id": {
      "type": "integer",
      "minimum": 0
    },
    "source": {
      "type": "string",
      "enum": [
        "live",
        "replay"
      ]
    },
    "config_hash": {
      "type": "string",
      "description": "Hash of rules.yaml + profiles.yml the engine is running with"
    },
    "pipeline_version": {
      "type": "integer",
      "minimum": 1
    },
    "health": {
      "type": "object",
      "additionalProperties": false,
      "required": [
        "rate_hz",
        "loss_udp",
        "loss_air",
        "invalid_ratio",
        "rejected",
        "warmup"
      ],
      "properties": {
        "rate_hz": {
          "type": "number",
          "minimum": 0
        },
        "loss_udp": {
          "type": "number",
          "minimum": 0,
          "maximum": 1
        },
        "loss_air": {
          "type": "number",
          "minimum": 0,
          "maximum": 1
        },
        "invalid_ratio": {
          "type": "number",
          "minimum": 0,
          "maximum": 1
        },
        "rejected": {
          "type": "object",
          "additionalProperties": {
            "type": "integer",
            "minimum": 0
          },
          "required": [
            "layout",
            "gain_invalid"
          ],
          "properties": {
            "layout": {
              "type": "integer",
              "minimum": 0
            },
            "gain_invalid": {
              "type": "integer",
              "minimum": 0
            }
          }
        },
        "warmup": {
          "type": "boolean",
          "description": "True for 3 s after a new boot_id and until every detector has its history. No event can start during warm-up."
        }
      }
    },
    "calibration": {
      "type": "object",
      "additionalProperties": false,
      "required": [
        "state",
        "id",
        "age_s"
      ],
      "properties": {
        "state": {
          "type": "string",
          "enum": [
            "none",
            "running",
            "ok",
            "stale"
          ]
        },
        "id": {
          "type": [
            "string",
            "null"
          ]
        },
        "age_s": {
          "type": [
            "number",
            "null"
          ],
          "minimum": 0
        }
      }
    },
    "presence": {
      "type": "object",
      "additionalProperties": false,
      "required": [
        "value",
        "state",
        "S",
        "B",
        "M"
      ],
      "properties": {
        "value": {
          "type": "boolean"
        },
        "state": {
          "type": "string",
          "enum": [
            "empty",
            "present",
            "uncertain"
          ]
        },
        "S": {
          "type": "number",
          "description": "Static deviation"
        },
        "B": {
          "type": "number",
          "description": "Breathing-band energy"
        },
        "M": {
          "type": "number",
          "description": "Motion"
        }
      }
    },
    "motion": {
      "type": "number",
      "minimum": 0
    },
    "posture": {
      "oneOf": [
        {
          "type": "null"
        },
        {
          "type": "object",
          "additionalProperties": false,
          "required": [
            "label",
            "since",
            "src"
          ],
          "properties": {
            "label": {
              "type": "string",
              "enum": [
                "unknown",
                "standing",
                "sitting",
                "lying"
              ]
            },
            "since": {
              "type": "integer",
              "description": "ms since epoch of the last known transition"
            },
            "src": {
              "type": "string",
              "enum": [
                "transitions",
                "walking",
                "start"
              ]
            }
          }
        }
      ],
      "description": "null when not present. label is unknown until the first transition or walking has been seen."
    },
    "count": {
      "oneOf": [
        {
          "type": "null"
        },
        {
          "type": "object",
          "additionalProperties": false,
          "required": [
            "value",
            "p",
            "src"
          ],
          "properties": {
            "value": {
              "type": "integer",
              "enum": [
                1,
                2
              ],
              "description": "2 means 2+"
            },
            "p": {
              "type": "array",
              "items": {
                "type": "number",
                "minimum": 0,
                "maximum": 1
              },
              "minItems": 2,
              "maxItems": 2
            },
            "src": {
              "type": "string",
              "enum": [
                "model"
              ]
            }
          }
        }
      ],
      "description": "null when the count model is not loaded."
    },
    "activity": {
      "oneOf": [
        {
          "type": "null"
        },
        {
          "type": "object",
          "additionalProperties": false,
          "required": [
            "label",
            "p",
            "probs",
            "src"
          ],
          "properties": {
            "label": {
              "$ref": "#/$defs/activityLabel"
            },
            "p": {
              "type": "number",
              "minimum": 0,
              "maximum": 1
            },
            "probs": {
              "type": "object",
              "propertyNames": {
                "$ref": "#/$defs/activityLabel"
              },
              "additionalProperties": {
                "type": "number",
                "minimum": 0,
                "maximum": 1
              }
            },
            "src": {
              "type": "string",
              "enum": [
                "model"
              ]
            }
          }
        }
      ],
      "description": "The movement model's guess for the last window: the top label, its probability and every class's probability. Experimental (below a constant guess on unseen people, docs/models.md): the dashboard shows it in the technical section only. null when no model is loaded or the window is less than 90 % valid."
    },
    "breathing": {
      "type": "object",
      "additionalProperties": false,
      "required": [
        "bpm",
        "confidence",
        "valid",
        "wave"
      ],
      "properties": {
        "bpm": {
          "type": [
            "number",
            "null"
          ],
          "minimum": 0
        },
        "confidence": {
          "type": "number",
          "minimum": 0,
          "maximum": 1
        },
        "valid": {
          "type": "boolean"
        },
        "wave": {
          "type": "array",
          "items": {
            "type": "number"
          },
          "description": "Breathing waveform samples produced in this window"
        }
      }
    },
    "csi": {
      "type": "array",
      "description": "Rows of exactly 52 log-amplitude (dB) values, the most recent frames of this window, for the heatmap only. (Length is checked by scripts/check-contracts.mjs, not by the schema, so the generated type stays number[][].)",
      "items": {
        "type": "array",
        "items": {
          "type": "number"
        }
      }
    },
    "position": {
      "description": "Experimental (lifefi.position): distance of the moving or breathing body from the link, from the last 10 s of packets. One link gives no direction, so this is a radius. Measured only while the person moves, held while they stay still. null while warming up or without enough packets. Optional: older engines leave it out.",
      "oneOf": [
        {
          "type": "null"
        },
        {
          "type": "object",
          "additionalProperties": false,
          "required": [
            "valid",
            "d_m",
            "d_sd",
            "R_db",
            "noise_db",
            "held",
            "zone",
            "people"
          ],
          "properties": {
            "valid": {
              "type": "boolean",
              "description": "true when the disturbance stands above the noise and d_m is set"
            },
            "d_m": {
              "type": [
                "number",
                "null"
              ],
              "minimum": 0,
              "description": "Kalman-smoothed distance in metres (0.2..8)"
            },
            "d_sd": {
              "type": [
                "number",
                "null"
              ],
              "minimum": 0,
              "description": "Standard deviation of d_m in metres"
            },
            "R_db": {
              "type": "number",
              "description": "Body disturbance, dB re 1 dB²"
            },
            "noise_db": {
              "type": "number",
              "description": "White-noise level left in the 0.25 s bin means, dB re 1 dB²"
            },
            "held": {
              "type": "boolean",
              "description": "true while the person stands still: d_m is the last distance measured while they moved (stillness would read as far away)"
            },
            "zone": {
              "oneOf": [
                {
                  "type": "null"
                },
                {
                  "type": "string",
                  "enum": [
                    "near",
                    "middle",
                    "far"
                  ]
                }
              ],
              "description": "near < 1.5 m, middle 1.5-3.5 m, far beyond; null without a distance"
            },
            "people": {
              "type": "integer",
              "minimum": 0,
              "description": "How many people to mark: the board's own head count from its USB log, at least 1 while presence is present, 0 when empty. One link cannot place them separately."
            },
            "spot": {
              "description": "The taught spot of this room from the spot model (engine/lifefi/spots.py, ml/train_spots.py), next to the distance estimate; null without a model or enough packets. Optional.",
              "oneOf": [
                {
                  "type": "null"
                },
                {
                  "type": "object",
                  "additionalProperties": false,
                  "required": [
                    "name",
                    "p",
                    "d_m"
                  ],
                  "properties": {
                    "name": {
                      "type": "string"
                    },
                    "p": {
                      "type": "number",
                      "minimum": 0,
                      "maximum": 1,
                      "description": "Smoothed probability of that spot"
                    },
                    "d_m": {
                      "type": [
                        "number",
                        "null"
                      ],
                      "minimum": 0,
                      "description": "The distance measured for that spot when it was taught; null for `empty`"
                    }
                  }
                }
              ]
            }
          }
        }
      ]
    },
    "link": {
      "description": "The radio link and the board's own view of it. Optional: older engines leave it out.",
      "type": "object",
      "additionalProperties": false,
      "required": [
        "rssi_dbm",
        "board"
      ],
      "properties": {
        "rssi_dbm": {
          "type": [
            "number",
            "null"
          ],
          "description": "Mean RSSI of the packets of the last 2 s, null when none arrived"
        },
        "board": {
          "description": "The firmware's own estimate from its USB log line (firmware/src/estimator.c), null when not reading the board over USB or it has not logged for 5 s",
          "oneOf": [
            {
              "type": "null"
            },
            {
              "type": "object",
              "additionalProperties": false,
              "required": [
                "state",
                "people"
              ],
              "properties": {
                "state": {
                  "type": "string",
                  "enum": [
                    "calibrating",
                    "empty",
                    "present",
                    "uncertain"
                  ]
                },
                "people": {
                  "type": [
                    "integer",
                    "null"
                  ],
                  "minimum": 0,
                  "description": "Head count estimate, null when the board does not know (\"?\")"
                }
              }
            }
          ]
        }
      }
    },
    "events": {
      "type": "array",
      "description": "Only the changes in this window",
      "items": {
        "$ref": "#/$defs/event"
      }
    },
    "active": {
      "type": "array",
      "description": "Ids of every currently active event. The server reconciles its open alerts against this list on every result.",
      "items": {
        "type": "integer"
      }
    }
  },
  "$defs": {
    "activityLabel": {
      "type": "string",
      "enum": [
        "none",
        "walking",
        "sit_down",
        "lie_down",
        "rise",
        "fall"
      ]
    },
    "eventType": {
      "type": "string",
      "enum": [
        "fall",
        "fainted_suspected",
        "no_breathing",
        "presence_uncertain",
        "recalibrate_needed",
        "bed_exit",
        "sensor_offline",
        "long_inactivity",
        "after_hours_occupancy"
      ]
    },
    "event": {
      "type": "object",
      "additionalProperties": false,
      "required": [
        "id",
        "type",
        "state",
        "t",
        "data"
      ],
      "properties": {
        "id": {
          "type": "integer",
          "minimum": 0,
          "description": "Unique per engine run, and not reused by the next run (the engine seeds them from its start time), so the server can reconcile alerts across engine restarts"
        },
        "type": {
          "$ref": "#/$defs/eventType"
        },
        "state": {
          "type": "string",
          "enum": [
            "active",
            "cleared"
          ]
        },
        "t": {
          "type": "integer",
          "description": "ms since epoch of the change"
        },
        "data": {
          "type": "object"
        }
      }
    }
  }
}
