{
  "type": "result",
  "v": 2,
  "ts": 1767225600123,
  "t_rx_last_us": 1767225600118000,
  "node": 1,
  "boot_id": 2913411,
  "source": "live",
  "config_hash": "9f3a1c",
  "pipeline_version": 2,
  "health": {
    "rate_hz": 88.1,
    "loss_udp": 0.004,
    "loss_air": 0.03,
    "invalid_ratio": 0.0,
    "rejected": {
      "layout": 0,
      "gain_invalid": 0
    },
    "warmup": false
  },
  "calibration": {
    "state": "ok",
    "id": "cal-0007",
    "age_s": 312
  },
  "presence": {
    "value": true,
    "state": "present",
    "S": 0.21,
    "B": 0.8,
    "M": 0.03
  },
  "motion": 0.03,
  "posture": {
    "label": "lying",
    "since": 1767225590000,
    "src": "transitions"
  },
  "count": {
    "value": 1,
    "p": [
      0.9,
      0.1
    ],
    "src": "model"
  },
  "activity": {
    "label": "none",
    "p": 0.91,
    "probs": {
      "none": 0.91,
      "walking": 0.02,
      "sit_down": 0.02,
      "lie_down": 0.03,
      "rise": 0.01,
      "fall": 0.01
    },
    "src": "model"
  },
  "breathing": {
    "bpm": 14.2,
    "confidence": 0.81,
    "valid": true,
    "wave": [
      0.12,
      0.18,
      0.21,
      0.17,
      0.09,
      0.01,
      -0.07,
      -0.14,
      -0.19,
      -0.21,
      -0.18,
      -0.12,
      -0.05,
      0.03,
      0.1,
      0.16,
      0.2,
      0.2,
      0.16,
      0.1,
      0.03,
      -0.05,
      -0.12,
      -0.18,
      -0.21
    ]
  },
  "csi": [
    [
      -42.1,
      -42.3,
      -42.0,
      -41.8,
      -41.9,
      -42.2,
      -42.5,
      -42.4,
      -42.1,
      -41.7,
      -41.5,
      -41.6,
      -41.9,
      -42.3,
      -42.6,
      -42.8,
      -42.7,
      -42.4,
      -42.0,
      -41.6,
      -41.3,
      -41.2,
      -41.4,
      -41.8,
      -42.2,
      -42.5,
      -42.6,
      -42.4,
      -42.1,
      -41.7,
      -41.4,
      -41.3,
      -41.5,
      -41.9,
      -42.3,
      -42.6,
      -42.7,
      -42.5,
      -42.2,
      -41.8,
      -41.5,
      -41.4,
      -41.6,
      -42.0,
      -42.4,
      -42.7,
      -42.8,
      -42.6,
      -42.3,
      -41.9,
      -41.6,
      -41.5
    ],
    [
      -42.2,
      -42.4,
      -42.1,
      -41.9,
      -42.0,
      -42.3,
      -42.6,
      -42.5,
      -42.2,
      -41.8,
      -41.6,
      -41.7,
      -42.0,
      -42.4,
      -42.7,
      -42.9,
      -42.8,
      -42.5,
      -42.1,
      -41.7,
      -41.4,
      -41.3,
      -41.5,
      -41.9,
      -42.3,
      -42.6,
      -42.7,
      -42.5,
      -42.2,
      -41.8,
      -41.5,
      -41.4,
      -41.6,
      -42.0,
      -42.4,
      -42.7,
      -42.8,
      -42.6,
      -42.3,
      -41.9,
      -41.6,
      -41.5,
      -41.7,
      -42.1,
      -42.5,
      -42.8,
      -42.9,
      -42.7,
      -42.4,
      -42.0,
      -41.7,
      -41.6
    ],
    [
      -42.0,
      -42.2,
      -41.9,
      -41.7,
      -41.8,
      -42.1,
      -42.4,
      -42.3,
      -42.0,
      -41.6,
      -41.4,
      -41.5,
      -41.8,
      -42.2,
      -42.5,
      -42.7,
      -42.6,
      -42.3,
      -41.9,
      -41.5,
      -41.2,
      -41.1,
      -41.3,
      -41.7,
      -42.1,
      -42.4,
      -42.5,
      -42.3,
      -42.0,
      -41.6,
      -41.3,
      -41.2,
      -41.4,
      -41.8,
      -42.2,
      -42.5,
      -42.6,
      -42.4,
      -42.1,
      -41.7,
      -41.4,
      -41.3,
      -41.5,
      -41.9,
      -42.3,
      -42.6,
      -42.7,
      -42.5,
      -42.2,
      -41.8,
      -41.5,
      -41.4
    ],
    [
      -42.1,
      -42.3,
      -42.0,
      -41.8,
      -41.9,
      -42.2,
      -42.5,
      -42.4,
      -42.1,
      -41.7,
      -41.5,
      -41.6,
      -41.9,
      -42.3,
      -42.6,
      -42.8,
      -42.7,
      -42.4,
      -42.0,
      -41.6,
      -41.3,
      -41.2,
      -41.4,
      -41.8,
      -42.2,
      -42.5,
      -42.6,
      -42.4,
      -42.1,
      -41.7,
      -41.4,
      -41.3,
      -41.5,
      -41.9,
      -42.3,
      -42.6,
      -42.7,
      -42.5,
      -42.2,
      -41.8,
      -41.5,
      -41.4,
      -41.6,
      -42.0,
      -42.4,
      -42.7,
      -42.8,
      -42.6,
      -42.3,
      -41.9,
      -41.6,
      -41.5
    ],
    [
      -42.2,
      -42.4,
      -42.1,
      -41.9,
      -42.0,
      -42.3,
      -42.6,
      -42.5,
      -42.2,
      -41.8,
      -41.6,
      -41.7,
      -42.0,
      -42.4,
      -42.7,
      -42.9,
      -42.8,
      -42.5,
      -42.1,
      -41.7,
      -41.4,
      -41.3,
      -41.5,
      -41.9,
      -42.3,
      -42.6,
      -42.7,
      -42.5,
      -42.2,
      -41.8,
      -41.5,
      -41.4,
      -41.6,
      -42.0,
      -42.4,
      -42.7,
      -42.8,
      -42.6,
      -42.3,
      -41.9,
      -41.6,
      -41.5,
      -41.7,
      -42.1,
      -42.5,
      -42.8,
      -42.9,
      -42.7,
      -42.4,
      -42.0,
      -41.7,
      -41.6
    ]
  ],
  "events": [],
  "active": [],
  "position": {
    "valid": true,
    "d_m": 1.8,
    "d_sd": 0.4,
    "R_db": -9.1,
    "noise_db": -21.3,
    "held": false,
    "zone": "middle",
    "people": 1,
    "spot": {
      "name": "close",
      "p": 0.91,
      "d_m": 0.4
    }
  },
  "link": {
    "rssi_dbm": -52.5,
    "board": {
      "state": "present",
      "people": 1
    }
  }
}
